,username,TwitterID,DateTime,content,likes,retweet,replies,image,articleImage,video
1877,ClevelandClinic,869686359086178304,3:46 PM - 30 May 2017,How to cut sugar from your diet for good – in just 10 days with @markhymanmd: http://cle.clinic/2rkzsyG pic.twitter.com/7T3vtmjFFU,221,122,4,https://pbs.twimg.com/media/DBGKdgoV0AALBCg.jpg,,
1878,ClevelandClinic,869665851603070978,2:24 PM - 30 May 2017,"Thanks, @heatherlgornik -- our mistake. Should be ""people with pain"".",1,0,0,,,
1879,ClevelandClinic,869659703281729536,2:00 PM - 30 May 2017,Are your kids eager to hop on their #bikes this season? Make sure their heads are protected http://cle.clinic/2rGzKAA pic.twitter.com/N5xTm1zYut,56,43,0,,,"['PlayableMedia', 'PlayableMedia--video']"
1880,ClevelandClinic,869647351857594368,1:11 PM - 30 May 2017,Pooling efforts at the global level against this newly recognized autoimmune disease:http://cle.clinic/2oTuDc3 pic.twitter.com/S7IjtTbUB9,36,20,2,https://pbs.twimg.com/media/DBFZXGBUIAA61e8.jpg,,
1881,ClevelandClinic,869630999277318147,12:06 PM - 30 May 2017,Here's genetic proof that you really do love or hate cilantro http://cle.clinic/2q76Au5 pic.twitter.com/qVweCLkTIP,87,42,3,https://pbs.twimg.com/media/DBF9hcLU0AADcDH.jpg,,
1882,ClevelandClinic,869614387601981440,11:00 AM - 30 May 2017,Does ‘good’ cholesterol still matter in preventing #heartdisease?http://wapo.st/2rknKo2,55,32,0,,https://t.co/AfMzdSRNU2,
1883,ClevelandClinic,869599033488097280,9:59 AM - 30 May 2017,"Negative thinking can become a habit. Rather than changing the way you think, do this instead: http://cle.clinic/2oDqTM6 pic.twitter.com/U4nXr3LJGU",209,155,4,https://pbs.twimg.com/media/DBFcIj1UMAQHXar.jpg,,
1884,ClevelandClinic,869569338272923648,8:01 AM - 30 May 2017,Don't forgot to join our Facebook LIVE Q&A with @jamecancerdoc at 11:30am today. Ask your ?'s live and he'll answer on Facebook!pic.twitter.com/gK2d2J6JEi,18,6,0,https://pbs.twimg.com/media/DBFUcMfUwAADA15.jpg,,
1885,ClevelandClinic,869554492374749184,7:02 AM - 30 May 2017,Kids often don't have symptoms when they have THIS liver infection http://bit.ly/2rmd6ha  via @usnews,19,14,0,,https://t.co/yJnTAWKIlj,
1886,ClevelandClinic,869531844206874625,5:32 AM - 30 May 2017,Q: Will sit-ups reduce belly fat? A: http://cle.clinic/1MycDhu pic.twitter.com/xAYUc0TnZt,44,30,0,https://pbs.twimg.com/media/DBBviLOUAAAt1l7.jpg,,
1887,ClevelandClinic,869498621351182337,3:20 AM - 30 May 2017,What happens to you body when you put butter in your coffee: http://cle.clinic/2oDIc2D pic.twitter.com/x6P18UDhzk,101,60,15,https://pbs.twimg.com/media/DBBj13vV0AE-gOY.jpg,,
1888,ClevelandClinic,869396951904550913,8:36 PM - 29 May 2017,The clue to clogged arteries is in your feet  http://cle.clinic/2p6G1V3 pic.twitter.com/nO555IZIZP,77,68,2,https://pbs.twimg.com/media/DBBu4U2VYAABYQp.jpg,,
1889,ClevelandClinic,869389401519828992,8:06 PM - 29 May 2017,"Five biggest reasons women don't enjoy sex, explained http://cle.clinic/2p8Wmth pic.twitter.com/69cSt2QyNG",47,24,3,https://pbs.twimg.com/media/DBBjQWxUAAEB75m.jpg,,
1890,ClevelandClinic,869375314325114880,7:10 PM - 29 May 2017,7 strange things #STRESS can do to your body. http://cle.clinic/2rdS2q4 pic.twitter.com/3rHFQ0dpm7,110,95,4,https://pbs.twimg.com/media/DBBovaLUIAA4cTR.jpg,,
1891,ClevelandClinic,869344103477018624,5:06 PM - 29 May 2017,"3 best ways to prevent crepey, thin skin as you age. http://cle.clinic/2oyQ0kV pic.twitter.com/FtDvXHr0Ed",87,56,2,https://pbs.twimg.com/media/DBBkL-cUAAA35P6.jpg,,
1892,ClevelandClinic,869333534095187968,4:24 PM - 29 May 2017,You could be ruining your teeth with these 5 habits http://cle.clinic/2oW691G pic.twitter.com/6YjoY4Iy9Y,41,30,1,https://pbs.twimg.com/media/DBBs9JZUIAAmvlU.jpg,,
1893,ClevelandClinic,869327746349924352,4:01 PM - 29 May 2017,Jump over to our Facebook page tomorrow @ 11:30am EST & ask @jamecancerdoc your questions about #breastcancer LIVE.pic.twitter.com/fn5kmwbEYT,22,18,1,https://pbs.twimg.com/media/DBBwr4rVYAAfPl5.jpg,,
1894,ClevelandClinic,869323970520039425,3:46 PM - 29 May 2017,"These 10 foods are the worst trans fat offenders from @KristinKirkpat
http://cle.clinic/2q8QoUZ pic.twitter.com/J15QmxFmhl",43,46,1,https://pbs.twimg.com/media/DBBuAmqVwAA6P2S.jpg,,
1895,ClevelandClinic,869297314531164160,2:00 PM - 29 May 2017,"For many, Memorial Day marks the peak of #allergy season. Follow these tips to help keep allergens outdoors http://cle.clinic/2qTp0O9 pic.twitter.com/pnOe0uqXnD",49,33,1,,,"['PlayableMedia', 'PlayableMedia--video']"
1896,ClevelandClinic,869268606944632832,12:06 PM - 29 May 2017,The dangers of under-cooking or overcooking your meats. http://cle.clinic/2qvmon6 pic.twitter.com/IJNu1KjVwi,68,56,2,https://pbs.twimg.com/media/DBA3jMkVoAERI9n.jpg,,
1897,ClevelandClinic,869221815666782209,9:00 AM - 29 May 2017,Caregiver @clevelandclinic & mother of fallen soldier reminds us: #MemorialDay is about honoring the contributions of our service members.pic.twitter.com/X46ChKJPD6,72,22,1,https://pbs.twimg.com/media/DAxkzGZXcAEkfWO.jpg,,
1898,ClevelandClinic,869146301438377985,4:00 AM - 29 May 2017,"On this day of #Remembrance, we salute the men and women who have sacrificed for our freedom #MemorialDaypic.twitter.com/rsN4W60ymm",386,171,7,https://pbs.twimg.com/media/DArmTpaXgAQpVo6.jpg,,
1899,ClevelandClinic,869035570634280960,8:40 PM - 28 May 2017,A new fecal incontinence treatment that imitates the function of the anal sphincter: http://cle.clinic/2r6VWDt pic.twitter.com/xarvirXxKJ,41,13,2,https://pbs.twimg.com/media/DAyR0AGU0AAl2qt.jpg,,
1900,ClevelandClinic,869027769556008960,8:09 PM - 28 May 2017,This is why alcohol and sleep don't mix. http://cle.clinic/2r1UHEQ pic.twitter.com/AdqWJoXpFf,93,72,3,https://pbs.twimg.com/media/DA7UYhVUMAAfDM1.jpg,,
1901,ClevelandClinic,869012921187057665,7:10 PM - 28 May 2017,"If it takes you less than 5 min to fall asleep you're probably sleep deprived (it should take 10-15)
More facts: http://cle.clinic/2oZ7qnH pic.twitter.com/3SRix8bO1k",137,126,2,https://pbs.twimg.com/media/DA7LmSFV0AA3duU.jpg,,
1902,ClevelandClinic,868981715091337217,5:06 PM - 28 May 2017,"Try our strawberry pretzel dessert
It's 30% less sugar & 1/2 calories & fat than the traditional http://cle.clinic/2ruHjLd  #MemorialDayWeekendpic.twitter.com/GzFytEcsmx",142,63,2,https://pbs.twimg.com/media/DA7P9RKUAAAo4X1.jpg,,
1903,ClevelandClinic,868971147358068736,4:24 PM - 28 May 2017,Are your parathyroid glands causing you problems? 3 symptoms to watch for: http://cle.clinic/2qpwlpX pic.twitter.com/eBqNGwotlS,70,49,3,https://pbs.twimg.com/media/DA7KQVNVYAIvPB-.jpg,,
1904,ClevelandClinic,868961586437914624,3:46 PM - 28 May 2017,5 tips to keep your bowels healthyhttp://cle.clinic/2s432GK,75,53,1,,https://t.co/iM4mIMQleG,
1905,ClevelandClinic,868933654264725505,1:55 PM - 28 May 2017,Planning to attend a #Memorial Day parade? Don't forget to protect your head from the sun http://cle.clinic/2rldnB3 pic.twitter.com/79BLJFOJqO,39,29,1,,,"['PlayableMedia', 'PlayableMedia--video']"
1906,ClevelandClinic,868922577103851521,1:11 PM - 28 May 2017,An innovative procedure that helps ease gastroparesis symptoms without surgery: http://cle.clinic/2paNH9j pic.twitter.com/FLwXVrUd7f,62,32,0,https://pbs.twimg.com/media/DAyOrDRUwAAMdPY.jpg,,
1907,ClevelandClinic,868906722319978496,12:08 PM - 28 May 2017,"7 tips to avoid #weightgain at picnics and barbecues. 
http://cle.clinic/2ruGSjS 
#MemorialDayWeekendpic.twitter.com/TsQbmL303E",44,25,2,https://pbs.twimg.com/media/DA7TNodUIAAl-SZ.jpg,,
1908,ClevelandClinic,868874258730151936,9:59 AM - 28 May 2017,A new option for people with complex regional pain syndrome in the lower extremities: http://cle.clinic/2opm4Yu pic.twitter.com/Pi2dmxyS1x,49,29,0,https://pbs.twimg.com/media/DAyOL17UwAAsj1l.jpg,,
1909,ClevelandClinic,868850520043253760,8:24 AM - 28 May 2017,14 surprising sources of GLUTEN (and where to spot them)! http://cle.clinic/2o6YvDu pic.twitter.com/JcbdFwp3Vd,42,24,1,https://pbs.twimg.com/media/DA7GdlXUMAEQvIX.jpg,,
1910,ClevelandClinic,868829714495881216,7:02 AM - 28 May 2017,Parents: Have a picky eater on your hand? @jenwilloughbyRD shares what you need to know http://bit.ly/2s01Bs8  via @usnews,30,15,0,,https://t.co/2L3iIFyqaN,
1911,ClevelandClinic,868785171264266240,4:05 AM - 28 May 2017,Trust & time will help shape the future of health technology http://bit.ly/2pQ8Ea5  #futurehealth @PhilipsHealth @BrianDonleyMD,18,11,1,,,
1912,ClevelandClinic,868773847813828608,3:20 AM - 28 May 2017,3 ways to avoid it getting a cramp in your side when you workout: http://cle.clinic/2pbnkjA pic.twitter.com/hVgKxd9nlA,63,40,0,https://pbs.twimg.com/media/DA2EuF7UIAAIECu.jpg,,
1913,ClevelandClinic,868673433411829761,8:41 PM - 27 May 2017,Oral sex and throat cancer. The link between the two will shock you: http://cle.clinic/2ogofz0 pic.twitter.com/bYTIyrnsvx,122,163,13,https://pbs.twimg.com/media/DAyNYtrVYAAY4oO.jpg,,
1914,ClevelandClinic,868665380679499777,8:09 PM - 27 May 2017,"When memory loss is normal, and when it's not: http://cle.clinic/2qhwdUy pic.twitter.com/k8qoHhkIbb",66,54,3,https://pbs.twimg.com/media/DA2GuXTUQAMMAFl.jpg,,
1915,ClevelandClinic,868650533493583875,7:10 PM - 27 May 2017,Don't ignore these 5 vague signs of cervical and ovarian cancer. http://cle.clinic/2ql6m2U pic.twitter.com/w0JXcsyYH6,61,49,2,https://pbs.twimg.com/media/DAyjRFwVoAAsDgD.jpg,,
1916,ClevelandClinic,868633925203226624,6:04 PM - 27 May 2017,How to lose weight after 40. @KristinKirkpat shares 6 lifestyle habits for you to focus on http://on.today.com/2rRMEcl  via @TODAYshow,183,101,1,,https://t.co/BkEMwCUQBz,
1917,ClevelandClinic,868619327183790080,5:06 PM - 27 May 2017,Neck and shoulder pain so commonly overlap that some refer to it as ‘shneck’ pain.http://cle.clinic/2qkQptD,110,71,1,,https://t.co/Ep41H5SYUQ,
1918,ClevelandClinic,868608757705588737,4:24 PM - 27 May 2017,"If you had chicken pox as a kid, you're at greater risk for this: http://cle.clinic/2nPWiK7 pic.twitter.com/rtJo1cElWE",58,65,7,https://pbs.twimg.com/media/DA2Dzu1UwAAmFyR.jpg,,
1919,ClevelandClinic,868599194746933249,3:46 PM - 27 May 2017,What does it mean if you have a spot on your lung? http://cle.clinic/2qmeC2Z pic.twitter.com/9t6CAlVEBs,51,38,3,https://pbs.twimg.com/media/DA1-8jvVwAA6v9C.jpg,,
1920,ClevelandClinic,868572533091581953,2:00 PM - 27 May 2017,"For those with #celiac disease, it might be tough to skip the hotdog or hamburger buns this weekend, but worth it http://bit.ly/2rIWQDN pic.twitter.com/s63e200NAc",47,22,0,,,"['PlayableMedia', 'PlayableMedia--video']"
1921,ClevelandClinic,868560190160896000,1:11 PM - 27 May 2017,A new minimally invasive ultrasound procedure for certain men with prostate cancer:  http://cle.clinic/2qXrVp4 pic.twitter.com/FSpofEeCBY,50,34,1,https://pbs.twimg.com/media/DAyM7R7UAAAxOw7.jpg,,
1922,ClevelandClinic,868543831863590914,12:06 PM - 27 May 2017,"What you should (and shouldn't) eat when you're on the road. http://cle.clinic/2s1seNW 
#MemorialDayWeekendpic.twitter.com/KhgONp4637",22,25,0,https://pbs.twimg.com/media/DA1-JIbVYAA4_8e.jpg,,
1923,ClevelandClinic,868527472689664000,11:01 AM - 27 May 2017,"100 lb #weightloss win for Spanish @cavs announcer @ElalcaldeRafa thanks to #lifestylechange
http://bit.ly/2r0mlTd  via @CrainsCleveland",36,8,2,,,
1924,ClevelandClinic,868511871187296256,9:59 AM - 27 May 2017,Studies show this alternative therapy is an important part of helping pain people maintain health http://cle.clinic/2nFdJPW pic.twitter.com/Ni1LoUkcme,78,44,1,https://pbs.twimg.com/media/DAyNE1zV0AAwmlU.jpg,,
1925,ClevelandClinic,868481670877331458,7:59 AM - 27 May 2017,"6 ways to battle aging, thinning hair. http://cle.clinic/2q0fKr7 pic.twitter.com/yiy7RXJItj",50,21,3,https://pbs.twimg.com/media/DAywvqkVYAI-jRn.jpg,,
1926,ClevelandClinic,868467327469109248,7:02 AM - 27 May 2017,The best ways to cope with an eczema flare-up on your face http://bit.ly/2rRrT0l  via @goodhealth,46,26,1,,https://t.co/LrmbyeWit1,
1927,ClevelandClinic,868445685024137216,5:36 AM - 27 May 2017,3 ways to control your high blood pressure (without drugs!) http://cle.clinic/2qBrdhS pic.twitter.com/532vMR4YUt,117,82,3,https://pbs.twimg.com/media/DAywGSZVwAAClsF.jpg,,
1928,ClevelandClinic,868422782966571008,4:05 AM - 27 May 2017,"Traveling this weekend?
 How to take a long trip and still feel good when you get there: http://bit.ly/2qmrsdu  via @goodhealth",65,38,0,,https://t.co/0uenT7Btpf,
1929,ClevelandClinic,868411461428813824,3:20 AM - 27 May 2017,How to handle those pesky skin tags: http://cle.clinic/2oXTtqT pic.twitter.com/HqL5aB8Sft,40,22,1,https://pbs.twimg.com/media/DAyvrouVoAAw24q.jpg,,
1930,ClevelandClinic,868310545228861441,8:39 PM - 26 May 2017,Research shows the protein-sparing modified fast diet can be used for long-term weight loss http://cle.clinic/2noyDQK pic.twitter.com/l12K82VkVk,117,75,1,https://pbs.twimg.com/media/DAyMEdXUIAEHRfM.jpg,,
1931,ClevelandClinic,868302741931741184,8:08 PM - 26 May 2017,Ever noticed tiny white bumps on your skin? Leave them alone! Here's why: http://cle.clinic/2nmQBqR pic.twitter.com/kzLvq8w93S,69,44,0,https://pbs.twimg.com/media/DAyuDphUMAEPKXN.jpg,,
1932,ClevelandClinic,868288147960061952,7:10 PM - 26 May 2017,Read this if you're a snorer (or if one keeps you awake). http://cle.clinic/2rqACtn pic.twitter.com/jnxjsrIdLm,45,29,0,https://pbs.twimg.com/media/DAymCMEV0AAJRQu.jpg,,
1933,ClevelandClinic,868261974362247168,5:26 PM - 26 May 2017,Six dietitians name their favorite sources of protein: http://cle.clinic/2oDa1rT pic.twitter.com/QBJohHvUF0,80,56,4,https://pbs.twimg.com/media/DAytcMCV0AAbzBS.jpg,,
1934,ClevelandClinic,868253920010788864,4:54 PM - 26 May 2017,Six ways alcohol affects your health — not just your liver http://cle.clinic/2qipK07 pic.twitter.com/bTf3k2AFqU,63,48,2,https://pbs.twimg.com/media/DAyoGU5VwAAiIGH.jpg,,
1935,ClevelandClinic,868240835464224768,4:02 PM - 26 May 2017,RT us your questions about #breastcancer and @jamecancerdoc will answer LIVE on Facebook this Tuesday @ 11:30 am EST.pic.twitter.com/rdnhdmvYgK,22,12,3,https://pbs.twimg.com/media/DAyW_eyVwAAAmMV.jpg,,
1936,ClevelandClinic,868236808638746625,3:46 PM - 26 May 2017,"To help alleviate your creaky knees and soothe the discomfort, try this: http://cle.clinic/2oy64Rl pic.twitter.com/7XjJIwEDSS",73,47,2,https://pbs.twimg.com/media/DAyYLJ7V0AAnNG8.jpg,,
1937,ClevelandClinic,868210391720919040,2:01 PM - 26 May 2017,Shopping for new #running shoes this weekend? Listen to these tips from podiatrist Joy Rowland to protect your feet from injurypic.twitter.com/Xt4f3twnOS,115,92,1,,,"['PlayableMedia', 'PlayableMedia--video']"
1938,ClevelandClinic,868200846529634304,1:23 PM - 26 May 2017,7T imaging is allowing neuroscience researchers to see clearer than ever: http://cle.clinic/2oxtEx2 pic.twitter.com/ZBv5IOpZri,61,26,1,https://pbs.twimg.com/media/DAx4ECJVYAIvbcx.jpg,,
1939,ClevelandClinic,868181442676760576,12:06 PM - 26 May 2017,Work these veggies into your diet for better heart health:http://cle.clinic/2pSDPAp,104,62,0,,https://t.co/CpHOkzP11S,
1940,ClevelandClinic,868164844582715393,11:00 AM - 26 May 2017,Ohio at center of #opioidcrisis - #Cleveland forum looks at ways to end the epidemic http://via.fox8.com/cKjvJ  via @fox8news #CCCHF,17,16,2,,https://t.co/fTZKqufp8M,
1941,ClevelandClinic,868150121594277888,10:01 AM - 26 May 2017,Discover how our bodies make sweat and why some of us do it more than others. http://cle.clinic/2p7lV8T pic.twitter.com/ZrpznIDFEf,43,35,2,https://pbs.twimg.com/media/DAxJ23EW0AAH1Ax.jpg,,
1942,ClevelandClinic,868135718559907840,9:04 AM - 26 May 2017,Amazing young #patient inspires #marrowdonors:  http://cle.clinic/2qWL0b7  via @wkyc,24,14,0,,https://t.co/3oON9ZgzfF,
1943,ClevelandClinic,868135400048476160,9:03 AM - 26 May 2017,Today is #DontFryDay. Don’t forget those 'easy to miss' places when applying sunscreen http://cle.clinic/2rldnB3 pic.twitter.com/Hrnm8DvD8L,25,23,0,,,"['PlayableMedia', 'PlayableMedia--video']"
1944,ClevelandClinic,868110300196864002,7:23 AM - 26 May 2017,Congrats to our @NBA Eastern Conference champs — the @Cavs! #DefendtheLandpic.twitter.com/5xGtvq3rju,114,34,2,https://pbs.twimg.com/media/DAwlp3JXkAAJolQ.jpg,,
1945,ClevelandClinic,868105193568837632,7:03 AM - 26 May 2017,"Are any hot dogs ""healthy"" hot dogs? @KristinKirkpat provides some answers:http://bit.ly/2qTpmo4",37,20,0,,https://t.co/gwiypXsUrP,
1946,ClevelandClinic,868049070992109568,3:20 AM - 26 May 2017,This is why you should add lemon to your water  http://cle.clinic/2nG5C2q  @RoxanneSukolMD,264,197,8,,https://t.co/Z5qduOyPOP,
1947,ClevelandClinic,867962499936780288,9:36 PM - 25 May 2017,Do you wake up from a painful charley horse in the middle of the night? How to stop it: http://cle.clinic/2pDWP2V pic.twitter.com/haooH60flz,75,52,0,https://pbs.twimg.com/media/DAuKV_QXYAE25gr.jpg,,
1948,ClevelandClinic,867949415096434690,8:44 PM - 25 May 2017,A new study of wine experts finds enhanced brain areas associated with smell and memory: http://cle.clinic/2r1RwvD pic.twitter.com/pOOECujxFq,48,34,2,https://pbs.twimg.com/media/DAtw_y0XUAA9jjL.jpg,,
1949,ClevelandClinic,867940354590244864,8:08 PM - 25 May 2017,"ICYMI: Watch @TobyCosgroveMD, @vivek_murthy and Chuck Rosenberg @DEAHQ discuss the nation's #opioid epidemic. http://cle.clinic/2r37DL5 
#CCCHF",15,9,1,,,
1950,ClevelandClinic,867927728070115328,7:17 PM - 25 May 2017,Thanks for sharing your experience. Pls send us a direct message so we can put you in direct contact with the appropriate caregivers.,0,0,0,,,
1951,ClevelandClinic,867925758064414720,7:10 PM - 25 May 2017,Our dietitians picked 7 snacks they would NEVER eat. Did your favorite make the list? http://cle.clinic/2ocqRts pic.twitter.com/5MPdXsGncc,145,118,8,https://pbs.twimg.com/media/DAt9OElVYAA0NvY.jpg,,
1952,ClevelandClinic,867913174883815424,6:20 PM - 25 May 2017,"100 lb #weightloss win for Spanish @cavs announcer @ElalcaldeRafa thanks to #lifestylechange
http://bit.ly/2r0mlTd  via @CrainsCleveland",43,10,0,,,
1953,ClevelandClinic,867893067319095296,5:00 PM - 25 May 2017,May is #Brain Tumor Awareness Month. Learn how a special mask helped one woman avoid surgery to stop her brain tumor http://cle.clinic/2qXbNSK pic.twitter.com/DgLBsb10tq,58,47,1,,,"['PlayableMedia', 'PlayableMedia--video']"
1954,CleClinicMD,867879522535956480,4:06 PM - 25 May 2017,"""We need to change the culture. We aren't going to be able to enforce our way out of this epidemic."" Chuck Rosenberg #CCCHF",45,19,0,,,
1955,ClevelandClinic,867879609827766272,4:06 PM - 25 May 2017,What will change the country is your response to it - @vivek_murthy #CCCHF,24,10,1,,,
1956,ClevelandClinic,867876751954890753,3:55 PM - 25 May 2017,We are taking bold moves and we do random drug testing for all employees - @TobyCosgroveMD #CCCHF,44,11,5,,,
1957,ClevelandClinic,867874800395595777,3:47 PM - 25 May 2017,1 in 200 children are born with symptoms of #opioid withdrawal. #CCCHFhttp://cle.clinic/2qoRqMo,51,68,2,,https://t.co/r7Zt5SHl5b,
1958,ClevelandClinic,867874420672647168,3:46 PM - 25 May 2017,"5 clues to tell if you're becoming addicted to #opioids: http://cle.clinic/2rEkAf7 
#CCCHFpic.twitter.com/eHrsyPqn1n",25,32,1,https://pbs.twimg.com/media/DAsahNXXoAEvgpB.jpg,,
1959,ClevelandClinic,867873978500743168,3:44 PM - 25 May 2017,"As a parent, take action, talk to your kids early & expose to educational resources - @vivek_murthy #CCCHF",25,4,0,,,
1960,ClevelandClinic,867870689956679680,3:31 PM - 25 May 2017,Addiction is a health concern not a character flaw. @vivek_murthy #CCCHFhttp://cle.clinic/2rmJwrP,96,75,2,,https://t.co/v9oZgw9d6B,
1961,ClevelandClinic,867869809140256769,3:27 PM - 25 May 2017,It is a public health crisis. We need to change the culture and break the cycle - Chuck Rosenberg @DEAHQ,22,11,1,,,
1962,TobyCosgroveMD,867866620101705729,3:15 PM - 25 May 2017,"Ohio can help end the opioid crisis. @ClevelandClinic emphasizing non-opioid pain relief, developing uniform prescribing guidelines #CCCHF",85,37,8,,,
1963,ClevelandClinic,867866619275620352,3:15 PM - 25 May 2017,The #opioid epidemic is an opportunity for our profession to bring pain relief into the 21st century - @TobyCosgroveMD #CCCHF,51,29,7,,,
1964,TobyCosgroveMD,867863348217610240,3:02 PM - 25 May 2017,"We face historic tragedy. Ohio stands at the center of the #opioid crisis. In 2015, we saw over 2,500 overdose deaths #CCCHF",51,46,2,,,
1965,ClevelandClinic,867864604709408769,3:07 PM - 25 May 2017,Healthcare has some responsibility in the #opioid epidemic. 75% of opioid & heroin deaths begin w/prescription drugs -@TobyCosgroveMD #CCCHF,90,84,10,,,
1966,ClevelandClinic,867863939849355265,3:04 PM - 25 May 2017,We are running a few minutes late. Be live at 6:10 pm,2,0,1,,,
1967,ClevelandClinic,867860329652506624,2:50 PM - 25 May 2017,"Follow Facebook LIVE tonight @ 6pm ET. @TobyCosgroveMD, @vivek_murthy, Chuck Rosenberg @DEAHQ discuss the #opioid epidemicpic.twitter.com/HjAO27wABs",19,15,8,https://pbs.twimg.com/media/DAsTZtfXoAAWzYB.jpg,,
1968,ClevelandClinic,867832650458943488,1:00 PM - 25 May 2017,"Follow Facebook LIVE tonight @ 6pm ET. @TobyCosgroveMD, @vivek_murthy, Chuck Rosenberg @DEAHQ discuss the #opioid epidemicpic.twitter.com/FvukcXzTnK",13,8,1,https://pbs.twimg.com/media/DAsTQdrXUAIbYNV.jpg,,
1969,ClevelandClinic,867819055142416384,12:06 PM - 25 May 2017,2 symptoms of cancer MEN should never ignore. http://cle.clinic/2oxTkKy pic.twitter.com/ijyKQZ89ow,25,23,1,https://pbs.twimg.com/media/DArzl7WWsAAlQ0O.jpg,,
1970,ClevelandClinic,867802455681249282,11:00 AM - 25 May 2017,"Tune into our Facebook LIVE event tonight @ 6pm ET. @TobyCosgroveMD, @vivek_murthy, Chuck Rosenberg @DEAHQ discuss the #opioid epidemic.pic.twitter.com/m5eblwizNe",9,8,0,https://pbs.twimg.com/media/DAsLD1wXkAI6y4K.jpg,,
1971,ClevelandClinic,867787095846334464,9:59 AM - 25 May 2017,"Anyone can develop age spots, but you are more likely if...http://cle.clinic/2pVb1XI pic.twitter.com/dz9WmWtL5c",23,9,0,https://pbs.twimg.com/media/DArzBurXgAEe4Qe.jpg,,
1972,ClevelandClinic,867743058556854273,7:04 AM - 25 May 2017,Staying fit after 40. @KristinKirkpat shares 6 lifetsyle habits for you to focus on:http://on.today.com/2rRMEcl,115,83,0,,https://t.co/BkEMwCUQBz,
1973,ClevelandClinic,867717637244977152,5:23 AM - 25 May 2017,3 conditions rainy weather can make worse — and what to do about it  http://cle.clinic/2p9JLB8 pic.twitter.com/1hM3vlYlgH,32,31,0,https://pbs.twimg.com/media/DAoVSGPXYAA0UWW.jpg,,
1974,ClevelandClinic,867698763514626048,4:08 AM - 25 May 2017,"60 yrs later, Cleveland Clinic BP discovery shows new promise in helping critically ill patients
http://cle.clinic/2qXhYZa  @KhannaAshishCCF",24,13,1,,https://t.co/q93vR3uYQT,
1975,ClevelandClinic,867688699831750656,3:28 AM - 25 May 2017,Is turkey bacon any healthier than pork bacon? http://cle.clinic/2qcsiwC pic.twitter.com/IiLPGzbj7L,36,33,0,https://pbs.twimg.com/media/DAoS5dzWsAA_Ghn.jpg,,
1976,ClevelandClinic,867586272449056768,8:41 PM - 24 May 2017,A difficult and distressing problem in people with underlying autoimmune diseases: http://cle.clinic/2pufKzg pic.twitter.com/56FhFI5EVN,36,33,0,https://pbs.twimg.com/media/DAoWVZaXcAEiY5U.jpg,,
1977,ClevelandClinic,867577966716268544,8:08 PM - 24 May 2017,Could your hair dye be causing health issues? Watch for these red flags: http://cle.clinic/2pPIYH5 pic.twitter.com/xCyCCnofqD,42,30,0,https://pbs.twimg.com/media/DAoWZGEXYAAp-Fb.jpg,,
1978,ClevelandClinic,867563369741549568,7:10 PM - 24 May 2017,Gout can damage more than your joints. This is why:http://cle.clinic/2rBEbwK,79,50,1,,https://t.co/QQumVijoo3,
1979,ClevelandClinic,867532165466042369,5:06 PM - 24 May 2017,How much #sleep do you actually need? Broken down by age: http://cle.clinic/2qXgJac pic.twitter.com/FQw5IlGve0,112,86,0,https://pbs.twimg.com/media/DAnr-BgXYAAWghB.jpg,,
1980,ClevelandClinic,867525731613585410,4:40 PM - 24 May 2017,Myth or fact: herniated discs need to be fixed with surgery? Get the facts. http://cle.clinic/2rAVxda pic.twitter.com/4Lq5V7AcqX,96,68,5,https://pbs.twimg.com/media/DAoRvHSXcAA6Dp7.jpg,,
1981,ClevelandClinic,867512032081227776,3:46 PM - 24 May 2017,"Can your nails indicate #stress, #melanoma and even kidney disease? Find out: http://cle.clinic/2riAyMs pic.twitter.com/kTC0iSMda1",52,47,0,https://pbs.twimg.com/media/DAnx9g4WAAEj5Py.jpg,,
1982,ClevelandClinic,867485381423267842,2:00 PM - 24 May 2017,May is #MentalHealth month. Often times there are warning signs of #depression in children http://cle.clinic/2riz6Gt pic.twitter.com/CkUtaNzK5F,48,43,0,,,"['PlayableMedia', 'PlayableMedia--video']"
1983,ClevelandClinic,867475037682515968,1:19 PM - 24 May 2017,An online colorectal cancer screening tool helps people better understand risk: http://cle.clinic/2rMTCiS pic.twitter.com/O4XJVmxC6D,25,11,0,https://pbs.twimg.com/media/DAnUtHYXcAACmMT.jpg,,
1984,ClevelandClinic,867466733254090753,12:46 PM - 24 May 2017,When pedicures go wrong -- 3 problems to look for. http://cle.clinic/2r4NXar pic.twitter.com/Li5canTM6X,25,12,0,https://pbs.twimg.com/media/DAm8u_YXoAAOJRf.jpg,,
1985,ClevelandClinic,867458934952656896,12:15 PM - 24 May 2017,We’re pleased to announce that we have signed a letter of intent w/ @Union_Hospital to join our health system.http://cle.clinic/2qWuQN8,76,32,1,,https://t.co/2on84nkNY9,
1986,ClevelandClinic,867440068553711616,11:00 AM - 24 May 2017,"Cleveland Clinic tests cooling cap to fight #BreastCancer hair loss http://s.cleveland.com/YUIllNW  @jamecancerdoc
via @clevelanddotcom",91,38,4,,https://t.co/fTF3p1qcif,
1987,ClevelandClinic,867430377060806656,10:21 AM - 24 May 2017,"We’re discussing the nation’s opioid epidemic & how to make changes.
Tune in to Facebook LIVE tmrw at 6pm EST @clevelandclinic. #CCCHFpic.twitter.com/VtFLTrOSRz",21,15,0,https://pbs.twimg.com/media/DAm7I2fW0AE6ufs.jpg,,
