,username,TwitterID,DateTime,content,likes,retweet,replies,image,articleImage,video
668,ClevelandClinic,899453502350479360,7:10 PM - 20 Aug 2017,"Itchy, dry skin? These 6 things can strip your skin of moisture:http://cle.clinic/2pndKpI",82,47,3,,https://t.co/Xm4iNYSHYU,
669,ClevelandClinic,899422296212942848,5:06 PM - 20 Aug 2017,We polled 8 dietitians -- these are their picks for best and worst sweeteners.http://cle.clinic/2p7iRKh,92,60,3,,https://t.co/3mWS2tcEw2,
670,ClevelandClinic,899411726562492417,4:24 PM - 20 Aug 2017,How to identify trigger points in your back and neck.http://cle.clinic/2qUQUWJ,139,63,1,,https://t.co/Y9R6IYfFVQ,
671,ClevelandClinic,899402163683766272,3:46 PM - 20 Aug 2017,Are certain people more likely to have cellulite? 5 questions answered:http://cle.clinic/2qo11Ud,72,33,1,,https://t.co/6CfsQ32plg,
672,ClevelandClinic,899346800720699392,12:06 PM - 20 Aug 2017,Why you crave these 4 foods and how to stop. http://cle.clinic/2vW0hfB,104,73,1,,https://t.co/7jNOcgFB0r,
673,ClevelandClinic,899314840690245634,9:59 AM - 20 Aug 2017,12 facts about your brain that will blow your mind!http://cle.clinic/2qc1gT1,238,114,2,,https://t.co/IqkbA2X0VJ,
674,ClevelandClinic,899284640539607040,7:59 AM - 20 Aug 2017,"Are sweet potato fries really the healthier option? @AnnaTaylorRD
explains:http://cle.clinic/2vGHa6k",60,36,7,,https://t.co/yefxrVoHld,
675,ClevelandClinic,899247646585520128,5:32 AM - 20 Aug 2017,Six dietitians name their picks for their top sources of protein:http://cle.clinic/2mdHE1p,304,208,4,,https://t.co/O6N1j0pSeQ,
676,ClevelandClinic,899214929525436416,3:22 AM - 20 Aug 2017,The harm in re-washing your prewashed produce:http://cle.clinic/2pYb2YB,137,88,2,,https://t.co/jB1BX2Wjpo,
677,ClevelandClinic,899105206440513536,8:06 PM - 19 Aug 2017,How to handle these pesky skin tags:http://cle.clinic/2rRvRGO,94,47,0,,https://t.co/fx5t3xQSDg,
678,ClevelandClinic,899091116036767744,7:10 PM - 19 Aug 2017,Are you at risk? #bloodclotshttp://cle.clinic/2x0G460,126,87,4,,https://t.co/K4f6CbVPSB,
679,ClevelandClinic,899059908200415233,5:06 PM - 19 Aug 2017,Why you risk injury by sleeping in the same position all night:http://cle.clinic/2pfz9nW,137,87,3,,https://t.co/vuyFAry5jd,
680,ClevelandClinic,899049338474602497,4:24 PM - 19 Aug 2017,Chocolate that's 70-85% cocoa offers the most nutritional benefit. Enjoy 1 oz. per day:http://cle.clinic/2v1baZH,465,267,8,,https://t.co/EJTBIDqwTc,
681,ClevelandClinic,899039776241614848,3:46 PM - 19 Aug 2017,What foods (and supplements) to avoid when you have #thyroid problems.http://cle.clinic/2qEe5Ja,103,69,2,,https://t.co/MHCsJFIsHI,
682,ClevelandClinic,899000769684283392,1:11 PM - 19 Aug 2017,Truths behind 6 common myths you may believe about drinking:http://cle.clinic/2pPJrZH,55,40,3,,https://t.co/8QVf6vS8W9,
683,ClevelandClinic,899000768585453568,1:11 PM - 19 Aug 2017,True or false: you should rinse your chicken before you cook it?http://cle.clinic/2sEVzwU,141,98,11,,https://t.co/Zx3iUy7NiO,
684,ClevelandClinic,898984411156234240,12:06 PM - 19 Aug 2017,Studies show a connection between bone loss and drinking THIS in women:http://cle.clinic/2q1IcWh,148,100,5,,https://t.co/GbT2eGFWKU,
685,ClevelandClinic,898952450434109442,9:59 AM - 19 Aug 2017,Is sparkling water as healthy as regular water? Your answer:http://cle.clinic/2tO2Sno,95,64,10,,https://t.co/3xnPvvltqT,
686,ClevelandClinic,898923033200664576,8:02 AM - 19 Aug 2017,Clearing up the myths about soy:http://cle.clinic/2v1cQ5f,64,33,1,,https://t.co/fIcROcdoBn,
687,ClevelandClinic,898885276541403136,5:32 AM - 19 Aug 2017,"Forget French toast. Try this gluten-free pancake #recipe instead!
Get the recipe: http://cle.clinic/2s7fu8g pic.twitter.com/2l61v7xoD4",281,133,11,,,"['PlayableMedia', 'PlayableMedia--video']"
688,ClevelandClinic,898852542075080704,3:22 AM - 19 Aug 2017,Need to lower your #cholesterol? Here's how to make it happen:http://cle.clinic/2uQX80K,210,135,3,,https://t.co/wtljOaqvRR,
689,ClevelandClinic,898751123854565376,8:39 PM - 18 Aug 2017,"Everyone has about 50,000 spontaneous thoughts per day. Keep them positive with these tips:http://cle.clinic/2vRbdse",479,301,10,,https://t.co/xWmq7OcPy6,
690,ClevelandClinic,898743826189230080,8:10 PM - 18 Aug 2017,"If you fall into one of these six categories, you should keep taking #vitaminD supplements:http://cle.clinic/2vM4q4J",189,96,3,,https://t.co/ibRHwchRyR,
691,ClevelandClinic,898728726728392704,7:10 PM - 18 Aug 2017,How a solar eclipse can trick your eyes and how to protect them. #SolarEclipse2017http://cle.clinic/2uTRA1y,230,153,6,,https://t.co/0LCUkFe0pe,
692,ClevelandClinic,898697520498581504,5:06 PM - 18 Aug 2017,Tips to reduce nighttime heartburn:http://cle.clinic/2uTXy2b,35,22,2,,https://t.co/UerYZcXAS1,
693,ClevelandClinic,898686951515070464,4:24 PM - 18 Aug 2017,When to call 911 or visit the ED.http://cle.clinic/2vQvSNe,70,38,3,,https://t.co/7yKTIx6DtY,
694,ClevelandClinic,898677391249354752,3:46 PM - 18 Aug 2017,"Every day, 63% of Americans log into at least 1 social media site multiple times. Doing so may hurt mental health:http://cle.clinic/2jgMwiz",181,125,10,,https://t.co/4cZoaXs5zy,
695,ClevelandClinic,898638380900143104,1:11 PM - 18 Aug 2017,Neck and shoulder pain so commonly overlap that some refer to it as ‘shneck’ pain.http://cle.clinic/2tkMoHa,133,62,3,,https://t.co/HXSnpKmBbO,
696,ClevelandClinic,898629847164928000,12:37 PM - 18 Aug 2017,How to beat bad ankles:http://cle.clinic/2xbBOzO,82,40,3,,https://t.co/EkyDN13KSQ,
697,ClevelandClinic,898608186638446592,11:11 AM - 18 Aug 2017,Here's what you need to know about 6 types of body fat. Advice from @CCLRI's Dr. J. Mark Brown in @WomensHealthMag.http://bit.ly/2w8g9M8,92,49,1,,https://t.co/55BAcGn6UJ,
698,ClevelandClinic,898590063084187648,9:59 AM - 18 Aug 2017,Discover how our bodies make sweat and why some of us do it more than others.http://cle.clinic/2p7lV8T,107,54,0,,https://t.co/f1ekk6Co1h,
699,ClevelandClinic,898559865349693442,7:59 AM - 18 Aug 2017,Answer 3 questions to find out what type of yoga is best for you:http://cle.clinic/2pnsyV5,68,28,1,,https://t.co/a174wHDYd9,
700,ClevelandClinic,898522873379381249,5:32 AM - 18 Aug 2017,Does coffee calm you or make you anxious? The reason may be in your genes.http://cle.clinic/2nX1tXI,186,122,8,,https://t.co/t97X5xTiM9,
701,ClevelandClinic,898490154850988034,3:22 AM - 18 Aug 2017,Stress strikes your body in these 7 places:http://cle.clinic/2per4xi,171,151,4,,https://t.co/sEsmq8Evrt,
702,ClevelandClinic,898388736873971714,8:39 PM - 17 Aug 2017,A new therapy provides relief for people with obstructive sleep apnea:http://cle.clinic/2tvoC7H,94,61,2,,https://t.co/BL82zkyyFX,
703,ClevelandClinic,898381438407499776,8:10 PM - 17 Aug 2017,5 surprising ways you can reduce teeth grinding:http://cle.clinic/2pRGPxh,99,51,0,,https://t.co/FMQpj96ohz,
704,ClevelandClinic,898373637312479233,7:39 PM - 17 Aug 2017,"3 best ways to prevent crepey, thin skin as you age.http://cle.clinic/2oyQ0kV",123,70,3,,https://t.co/ya1seBCiG1,
705,ClevelandClinic,898366338543964160,7:10 PM - 17 Aug 2017,Tips to maintain your spine health.http://cle.clinic/2uV8SeM,128,72,1,,https://t.co/ICtI87lF9Q,
706,ClevelandClinic,898335635861196800,5:08 PM - 17 Aug 2017,4-5% of U.S. adults suffer from adult ADHD. Here's how it's diagnosed.http://cle.clinic/2wUmMil,123,78,7,,https://t.co/hysx0u5h5t,
707,ClevelandClinic,898277001223577600,1:15 PM - 17 Aug 2017,These ingredients matter most when it comes to fighting dry skin. #skincarehttp://cle.clinic/2te55rY,83,41,3,,https://t.co/8WxDUUEBCM,
708,ClevelandClinic,898259634846220289,12:06 PM - 17 Aug 2017,How slow is too slow?http://cle.clinic/2w61YqF,97,63,12,,https://t.co/cdeGSAVYZJ,
709,ClevelandClinic,898230697088995330,10:11 AM - 17 Aug 2017,5 surprising ways clutter can impact your health:http://cle.clinic/2uRJCZG,180,93,17,,https://t.co/G79S9kurrq,
710,ClevelandClinic,898218373728706560,9:22 AM - 17 Aug 2017,Are you worried about UV exposure from nail curing lamps? Here’s what the experts say. Related: http://cle.clinic/2uTJFky pic.twitter.com/svbcx16Zsv,30,22,8,,,"['PlayableMedia', 'PlayableMedia--video']"
711,ClevelandClinic,898202120767361025,8:17 AM - 17 Aug 2017,"How a solar eclipse can trick your eyes and what to do about it: http://cle.clinic/2uTRA1y 
#SolarEclipse2017pic.twitter.com/rWFet7xQDI",187,154,8,,,"['PlayableMedia', 'PlayableMedia--video']"
712,ClevelandClinic,898160505507897344,5:32 AM - 17 Aug 2017,Try these 3 easy stretches to ease your carpal tunnel pain: http://cle.clinic/2fNipl6 pic.twitter.com/tBEiMArnBZ,304,204,3,,,"['PlayableMedia', 'PlayableMedia--video']"
713,ClevelandClinic,898127766876557313,3:22 AM - 17 Aug 2017,Here's how to avoid an ingrown hair after shavinghttp://cle.clinic/2oiXJQF,76,37,1,,https://t.co/S3zAuZCTPr,
714,ClevelandClinic,898018044701790208,8:06 PM - 16 Aug 2017,Did you know déjà vu occurs more frequently on evenings and weekends. Here's why it happens:http://cle.clinic/2oVerKw,148,89,3,,https://t.co/YOBpvDKS48,
715,ClevelandClinic,898011248268197888,7:39 PM - 16 Aug 2017,What you should (and shouldn't) eat after gallbladder surgery.http://cle.clinic/2oQkj73,61,45,0,,https://t.co/u0CSNcgCjf,
716,ClevelandClinic,898002189330690048,7:03 PM - 16 Aug 2017,Signs of job burnout:http://cle.clinic/2v3ctX2,123,104,3,,https://t.co/MmQGgrEWsa,
717,ClevelandClinic,897978247195103233,5:27 PM - 16 Aug 2017,Do topical creams relieve pain as well as their oral counterparts?http://cle.clinic/2wRfbkR,89,50,7,,https://t.co/A6ttKteE94,
718,ClevelandClinic,897936255748632576,2:41 PM - 16 Aug 2017,Sorting through the emerging therapies for this often overlooked condition:http://cle.clinic/2wbkOxc,44,9,2,,https://t.co/mgHIKkswN9,
719,TobyCosgroveMD,897929367401017344,2:13 PM - 16 Aug 2017,I remain committed to improving healthcare for Americans. Here’s the statement from the Strategic & Policy Forum:http://cle.clinic/2vJoVO0,96,33,23,,https://t.co/1r7RMY0POf,
720,ClevelandClinic,897865288116514819,9:59 AM - 16 Aug 2017,"The 3 kinds of naps, and how each helps you re-charge:http://cle.clinic/2o6w5rN",175,75,7,,https://t.co/WMVPEswQ0u,
721,ClevelandClinic,897852224520323072,9:07 AM - 16 Aug 2017,"If you're not walking your dog regularly, you may be missing out on health benefits.  http://cle.clinic/2w1Nw33 pic.twitter.com/ZlyYP7Huvk",205,90,8,,,"['PlayableMedia', 'PlayableMedia--video']"
722,ClevelandClinic,897798095509094401,5:32 AM - 16 Aug 2017,Do you wake up from a painful charley horse in the middle of the night? How to stop it:http://cle.clinic/2pDWP2V,104,51,3,,https://t.co/IfzQ9shOQL,
723,ClevelandClinic,897765127516303361,3:21 AM - 16 Aug 2017,Can't shake the soreness after a workout? Your diet may be a solution:http://cle.clinic/2pB8dMi,181,111,4,,https://t.co/NGIGnS2rHz,
724,ClevelandClinic,897655657645707264,8:06 PM - 15 Aug 2017,When a heart attack may have no symptoms at all.http://cle.clinic/2fJ8YTH,170,137,5,,https://t.co/ZcWdSz6Dpw,
725,ClevelandClinic,897641563026862080,7:10 PM - 15 Aug 2017,Why you crave these 4 foods and how to stop. http://cle.clinic/2vW0hfB,177,143,12,,https://t.co/7jNOcgFB0r,
726,ClevelandClinic,897610357979717632,5:06 PM - 15 Aug 2017,"Are sweet potato fries really the healthier option? @AnnaTaylorRD
explains:http://cle.clinic/2vGHa6k",71,35,5,,https://t.co/yefxrV76tF,
727,ClevelandClinic,897599788404715522,4:24 PM - 15 Aug 2017,6 conditions that could cause heavy bleeding in woman.http://cle.clinic/2hRjRDL,89,54,4,,https://t.co/Sd8Tbp2aqh,
728,ClevelandClinic,897590225802846209,3:46 PM - 15 Aug 2017,"Join @Google @LinkedIn @Verywell & more at #CMWorld Health Summit

Learn from healthcare's top content marketershttp://cle.clinic/CMW",19,11,1,,https://t.co/QD95L7uTaI,
729,ClevelandClinic,897560529400602624,1:48 PM - 15 Aug 2017,How adult coloring can calm and relax your brain. #NationalRelaxationDayhttp://cle.clinic/2vAU2fY,272,181,12,,https://t.co/iY2wIZMiqZ,
730,ClevelandClinic,897551988484956161,1:14 PM - 15 Aug 2017,Best evidence to date that gut bacteria plays a role in obesity:http://cle.clinic/2tQgVIf,144,98,3,,https://t.co/4u5yT6rgmL,
731,ClevelandClinic,897502902415048705,9:59 AM - 15 Aug 2017,Bothered by a boney bunion? Here's what to do:http://cle.clinic/2vYDjnT,71,38,4,,https://t.co/r850LrL2I2,
732,ClevelandClinic,897492834198011904,9:19 AM - 15 Aug 2017,"Important points about high-tech baby monitoring devices:

 - They are not for medical use
 - Can't detect apneahttp://bit.ly/2uYRFQz",39,14,2,,https://t.co/s3SlTHnsOq,
733,ClevelandClinic,897481615735173121,8:34 AM - 15 Aug 2017,There's a lot of weight loss advice out there. We put together a list of our best tips:http://cle.clinic/2oc3Olx,288,181,4,,https://t.co/De8YS0Wrz1,
734,ClevelandClinic,897435707156840448,5:32 AM - 15 Aug 2017,3 ways to control your high blood pressure (without medicine)!http://cle.clinic/2pzE28Y,165,102,2,,https://t.co/zpCBEPtNcZ,
735,ClevelandClinic,897402991413567488,3:22 AM - 15 Aug 2017,Stye in your eyes? What you should (and shouldn't) do:http://cle.clinic/2oi9mfw,155,87,6,,https://t.co/gisE4ar62Q,
736,ClevelandClinic,897301573021442048,8:39 PM - 14 Aug 2017,The curious case of women with upper abdominal pain and major weight loss:http://cle.clinic/2og0XnV,87,38,5,,https://t.co/R717tkK4B2,
737,ClevelandClinic,897293269293551616,8:06 PM - 14 Aug 2017,Why you might feel fuller when you've lost weight:http://cle.clinic/2nv7mjK,128,63,1,,https://t.co/ee1a0A5uXV,
738,ClevelandClinic,897279176696373249,7:10 PM - 14 Aug 2017,The reasons we crave sugar and salt.http://cle.clinic/2oLfr0V,136,112,4,,https://t.co/1Di7Iv2jax,
739,ClevelandClinic,897247969321385984,5:06 PM - 14 Aug 2017,How to detect if your B12 level is low:http://cle.clinic/2vyoXtD,141,73,2,,https://t.co/87kPuyJO0y,
740,ClevelandClinic,897237399931047936,4:24 PM - 14 Aug 2017,This is why carbs cause bloatinghttp://cle.clinic/2oW3mro,69,33,2,,https://t.co/s68kO7o9gZ,
741,ClevelandClinic,897227836599054340,3:46 PM - 14 Aug 2017,What are those little white bumps on your face and what do you do about them?http://cle.clinic/2nmQBqR,42,17,2,,https://t.co/aAM9utPU74,
742,ClevelandClinic,897188828758265857,1:11 PM - 14 Aug 2017,4 ways to get your metabolism moving in the right direction w/ @KristinKirkpat:http://cle.clinic/2vR5QZE,143,93,3,,https://t.co/C0g0HpiCh5,
743,ClevelandClinic,897160143930097664,11:17 AM - 14 Aug 2017,"Smaller gifts can make a big difference for projects on our new crowdfunding platform.

Story from @CrainsCleveland. http://bit.ly/2vybTTo",20,6,1,,,
744,ClevelandClinic,897140512301305856,9:59 AM - 14 Aug 2017,Can fasting help or hurt your heart? Here’s a cardiologist’s perspective:http://cle.clinic/2v0hNPL,128,91,5,,https://t.co/tLJhPNmWwn,
745,ClevelandClinic,897110314948337665,7:59 AM - 14 Aug 2017,5 of the best LUNCH options to keep you feeling your best.http://cle.clinic/2o5B762,86,45,2,,https://t.co/9cqhOSGKLx,
746,ClevelandClinic,897073321946296320,5:32 AM - 14 Aug 2017,The difference between farmed and wild salmon from @KristinKirkpat:http://cle.clinic/2hXkQCj,204,137,7,,https://t.co/ppTPUqHcra,
747,ClevelandClinic,897040602335936512,3:22 AM - 14 Aug 2017,Over oatmeal? Try these 7 types of grain to start your morning right!http://cle.clinic/2onXgQN,142,86,1,,https://t.co/UwUoNeJ3GH,
748,ClevelandClinic,896930879292850178,8:06 PM - 13 Aug 2017,What's the #1 way to prevent wrinkles?http://cle.clinic/2uEL7ak,200,99,8,,https://t.co/vnwByqa5K4,
749,ClevelandClinic,896916787698089984,7:10 PM - 13 Aug 2017,What foods (and supplements) to avoid when you have #thyroid problems.http://cle.clinic/2qEe5Ja,145,125,1,,https://t.co/MHCsJFIsHI,
750,ClevelandClinic,896885585385857024,5:06 PM - 13 Aug 2017,Can anything prevent your hair from graying?http://cle.clinic/2oJZAT3,103,53,6,,https://t.co/csCVQeLlsM,
751,ClevelandClinic,896875011138502656,4:24 PM - 13 Aug 2017,The acid in your stomach is strong enough to burn your skin. 8 more interesting #digestive facts:http://cle.clinic/2vsROzv,134,91,1,,https://t.co/p4SIyivdPT,
752,ClevelandClinic,896865448989310976,3:46 PM - 13 Aug 2017,FMD can cause #stroke in otherwise healthy women. Here are symptoms to watch for:http://cle.clinic/2oBN9ow,53,28,1,,https://t.co/0AmHEd3di9,
753,ClevelandClinic,896834023565262850,1:41 PM - 13 Aug 2017,Some apples have higher levels of nutrients than others. These are the best ones:http://cle.clinic/2rSnVre,318,219,5,,https://t.co/JtLlpHlNIs,
754,ClevelandClinic,896810083434217472,12:06 PM - 13 Aug 2017,Are protein bars wrecking your diet? How to choose wisely:http://cle.clinic/2uSL2iO,91,78,3,,https://t.co/g4jFyoQFYA,
755,ClevelandClinic,896778124800798720,9:59 AM - 13 Aug 2017,The protein-sparing modified fast diet can be used for long-term weight loss:http://cle.clinic/2noyDQK,145,72,2,,https://t.co/CAmXWPcFdf,
756,ClevelandClinic,896753963671863296,8:23 AM - 13 Aug 2017,"See how brain stimulation is helping a patient recover from a stroke. 

""It's exciting I can use my fingers.""
http://cle.clinic/2vtHh5r pic.twitter.com/GjBxGIuSLc",135,57,2,https://pbs.twimg.com/media/DG9QZR2V0AAYW4Q.jpg,,
757,ClevelandClinic,896748377924411392,8:00 AM - 13 Aug 2017,"To help alleviate your creaky knees and soothe the discomfort, try this:http://cle.clinic/2oy64Rl",138,72,1,,https://t.co/pP5lDFPCRu,
758,ClevelandClinic,896710930880282624,5:32 AM - 13 Aug 2017,Are these bad cooking habits making you fat? w/ @KristinKirkpathttp://cle.clinic/2oaneo2,94,51,4,,https://t.co/WuwJWXbDls,
759,ClevelandClinic,896678215196045312,3:22 AM - 13 Aug 2017,8 steps you can take to overcome resistant #hypertensionhttp://cle.clinic/2wEmkos,149,82,5,,https://t.co/lagu66ypFT,
760,ClevelandClinic,896568493293883393,8:06 PM - 12 Aug 2017,Read this if you're a snorer (or if one keeps you awake).http://cle.clinic/2rqACtn,150,87,4,,https://t.co/P0vdetWkos,
761,ClevelandClinic,896554399077515264,7:10 PM - 12 Aug 2017,These 7 steps can help you find the best pillow for the best http://cle.clinic/2nD1Hnw,156,82,1,,https://t.co/n8BIgIyoJ5,
762,ClevelandClinic,896523193405497344,5:06 PM - 12 Aug 2017,80% of causes of bladder issues are related to conditions outside the bladder.http://cle.clinic/2uQ6CVi,97,57,0,,https://t.co/ems7pKr1zM,
763,ClevelandClinic,896512623197511680,4:24 PM - 12 Aug 2017,Six less-known effects that alcohol has on your body.http://cle.clinic/2vPPMKG,99,73,2,,https://t.co/Lfqfj4Bs3o,
764,ClevelandClinic,896503060989652992,3:46 PM - 12 Aug 2017,The most common causes of painful ingrown toenails:http://cle.clinic/2o1gnkS,97,65,4,,https://t.co/3EAUiq40gV,
765,ClevelandClinic,896464054113505280,1:11 PM - 12 Aug 2017,"5 tips to relieve computer, tablet and smartphone induced eye strain:http://cle.clinic/2tkqNP7",139,97,0,,https://t.co/R1rwwDxPjJ,
766,ClevelandClinic,896447697837862914,12:06 PM - 12 Aug 2017,Build a better salad. Here's how:http://cle.clinic/2ou8v8v,361,215,5,,https://t.co/MKG90O78IO,
767,ClevelandClinic,896433855841714176,11:11 AM - 12 Aug 2017,"A patient of ours who was part of a clinical trial is defying the odds after brain tumor diagnosis.Thank you, @WEWS!http://bit.ly/2v58uwo",173,51,5,,https://t.co/kWRMAbaE9R,
768,ClevelandClinic,896415735412654080,9:59 AM - 12 Aug 2017,Can’t stomach butter? Here's what you should know about ghee:http://cle.clinic/2vsyfHq,88,49,6,,https://t.co/MnMBSx8U6r,
769,ClevelandClinic,896385536994050049,7:59 AM - 12 Aug 2017,Vasculitis: challenging symptoms & 5 common medications.http://cle.clinic/2vrlDQH,62,32,2,,https://t.co/vBbl8Kxz0L,
770,ClevelandClinic,896348544931479552,5:32 AM - 12 Aug 2017,What's better for your skin: shaving or waxing? We break it down:http://cle.clinic/2pxpjO8,71,41,3,,https://t.co/UoEUqY6vng,
771,ClevelandClinic,896206103284994049,8:06 PM - 11 Aug 2017,Do you have #PsoriaticArthritis? You may be at risk for one of these 11 conditions:http://cle.clinic/2vNfX4w,53,29,0,,https://t.co/83RAOkMgfK,
772,ClevelandClinic,896192010981220352,7:10 PM - 11 Aug 2017,6 conditions that could cause heavy bleeding in woman.http://cle.clinic/2hRjRDL,73,44,3,,https://t.co/Sd8Tbp2aqh,
773,ClevelandClinic,896184964752044032,6:42 PM - 11 Aug 2017,Here's what research says about melatonin and your #sleep:http://cle.clinic/2pe4Yd6,125,58,1,,https://t.co/y6Q3ylkSDw,
774,ClevelandClinic,896160824196079616,5:06 PM - 11 Aug 2017,Try this simple exam to check for thyroid nodules at home. http://cle.clinic/2fyfiNK pic.twitter.com/fJXFlQHSTw,231,170,1,,,"['PlayableMedia', 'PlayableMedia--video']"
775,ClevelandClinic,896140673061011456,3:46 PM - 11 Aug 2017,"Are you putting on extra ""wine weight"" from your nightly glass? Avoid it w/ these tips from @KristinKirkpat:http://cle.clinic/2ojDshl",98,66,4,,https://t.co/aaeCziFVBh,
776,ClevelandClinic,896101668705767426,1:11 PM - 11 Aug 2017,"Women may never get chest pain. Instead, they may develop these symptoms:http://cle.clinic/2lkC9cT",169,127,0,,https://t.co/rdW6AujKDi,
777,ClevelandClinic,896095137809420288,12:45 PM - 11 Aug 2017,These cute kids graduated from the Lerner School for Autism preschool program! Let's congratulate them on their promotion to kindergarten. pic.twitter.com/DAKwAQJ1XG,666,153,26,,,
778,ClevelandClinic,896085308009328640,12:06 PM - 11 Aug 2017,This is why you get hiccups (and how to make them stop)http://cle.clinic/2qh44Pg,131,62,3,,https://t.co/cEGU1OIpgn,
779,ClevelandClinic,896064435973898240,10:43 AM - 11 Aug 2017,Attention reporters: Woman who suffered stroke regains use of hand after DBS technique. Resources for a story:  http://cle.clinic/2uN1yAR pic.twitter.com/USyWoWBmis,146,74,3,,,"['PlayableMedia', 'PlayableMedia--video']"
780,ClevelandClinic,896053347408646144,9:59 AM - 11 Aug 2017,3 reasons you get dizzy when you stand up too quickly.http://cle.clinic/2nTRDth,90,40,1,,https://t.co/jWBqVMdMVy,
781,ClevelandClinic,895999122569822208,6:23 AM - 11 Aug 2017,Three types of topical treatments to try for #arthritis pain:http://cle.clinic/2vpZCC4,91,62,1,,https://t.co/dvFcAK2KcY,
782,ClevelandClinic,895953439473184768,3:22 AM - 11 Aug 2017,Are certain people more likely to have cellulite? 5 questions answered:http://cle.clinic/2uM0j4U,53,32,0,,https://t.co/5AvG0WN5ts,
783,ClevelandClinic,895834657375137792,7:30 PM - 10 Aug 2017,Apple or pear: which body shape is worse for your health?http://cle.clinic/2q0ajIG,81,53,2,,https://t.co/wdSQ9kBbcT,
784,ClevelandClinic,895808230265425920,5:45 PM - 10 Aug 2017,Going to #CMWorld? Stick around Sept. 8 to learn from the best in #healthcare content marketing.http://cle.clinic/CMW,33,15,1,,https://t.co/QD95L7uTaI,
785,ClevelandClinic,895787847348871168,4:24 PM - 10 Aug 2017,8 types of PAIN you shouldn't ignore:http://cle.clinic/2ovHKlY,140,103,4,,https://t.co/a5gHcGT5Bq,
786,ClevelandClinic,895778284998447104,3:46 PM - 10 Aug 2017,"Despite what you've heard, normal stress of day-to-day doesn't cause/contribute to ulcers. This does:http://cle.clinic/2oZ342Z",123,66,0,,https://t.co/k3zn1ju2M9,
787,ClevelandClinic,895767997180256256,3:05 PM - 10 Aug 2017,"Jennifer's 19th birthday wasn't supposed to take place in a hospital room, so our #digestive team threw her a surprise party!pic.twitter.com/hUwOosc85M",314,64,14,,,
788,ClevelandClinic,895753399781646336,2:07 PM - 10 Aug 2017,These simple tips may help your kids get back on a sleeping schedule for the new school year. http://cle.clinic/2wLq5Yx pic.twitter.com/cARuF6clLY,116,69,2,,,"['PlayableMedia', 'PlayableMedia--video']"
789,ClevelandClinic,895740034011111424,1:14 PM - 10 Aug 2017,A new study sheds light on the possible cause of non-celiac gluten sensitivity:http://cle.clinic/2nIbHex,91,58,1,,https://t.co/WHXYAMlMnC,
790,ClevelandClinic,895722922869833728,12:06 PM - 10 Aug 2017,"Recent news claims Moscow Mules in copper mugs could make you sick.
We explain the facts:http://cle.clinic/2wxIoRB",75,61,0,,https://t.co/UDQGXZBZXT,
791,ClevelandClinic,895690964148248576,9:59 AM - 10 Aug 2017,Price hikes for two critical inpatient heart drugs are ‘not benign’:http://cle.clinic/2urXuL0,29,13,1,,https://t.co/KEKe9XV0bg,
792,ClevelandClinic,895667731281858561,8:26 AM - 10 Aug 2017,Deep brain stimulation shows early promise for restoring movement to patient paralyzed by stroke. http://cle.clinic/DBS pic.twitter.com/2aFq8ZY9Ud,429,232,7,,,"['PlayableMedia', 'PlayableMedia--video']"
793,ClevelandClinic,895642876280946693,6:47 AM - 10 Aug 2017,Grandmother who suffered stroke regains use of her hand after innovative deep brain stimulation technique. http://cle.clinic/DBS pic.twitter.com/uzwlHLKxRh,236,86,5,,,"['PlayableMedia', 'PlayableMedia--video']"
794,ClevelandClinic,895638694509588480,6:31 AM - 10 Aug 2017,We're excited to share an innovative surgery is helping a patient recover from a devastating stroke.https://twitter.com/TIMEHealth/status/895633317042716672 …,205,88,9,,,
795,ClevelandClinic,895623770156781568,5:32 AM - 10 Aug 2017,6 deliciously healthy teas that may help prevent chronic disease:http://cle.clinic/2vqGpjS,194,134,2,,https://t.co/wBxaN2mUmU,
796,ClevelandClinic,895591053767593984,3:22 AM - 10 Aug 2017,"If you like your coffee creamy, use this type of milk:http://cle.clinic/2uHJiss",127,69,2,,https://t.co/sZlzAZx3z8,
797,ClevelandClinic,895481328384299013,8:06 PM - 9 Aug 2017,Gout can damage more than your joints. This is why:http://cle.clinic/2uIcMGC,172,123,2,,https://t.co/FnzWdYxNcI,
798,ClevelandClinic,895467236684648448,7:10 PM - 9 Aug 2017,Three natural ways to ease constipation:http://cle.clinic/2tsB6iw,122,68,4,,https://t.co/QyTwjMBJuO,
799,ClevelandClinic,895436034409775105,5:06 PM - 9 Aug 2017,Vaccines aren't just for kids.http://cle.clinic/2wCtVTG,135,90,1,,https://t.co/qsMK1Z47Eu,
800,ClevelandClinic,895436029859160065,5:06 PM - 9 Aug 2017,4 types of headaches and where they hurt:http://cle.clinic/2vjixil,88,58,2,,https://t.co/nlu9OhKjMk,
