,username,TwitterID,DateTime,content,likes,retweet,replies,image,articleImage,video
1309,ClevelandClinic,882369935447666692,3:46 PM - 4 Jul 2017,Common reasons back pain develops as you age (and what you can do about it):http://cle.clinic/2sCMBVE,170,104,5,,https://t.co/Wn9pARgFdi,
1310,ClevelandClinic,882343264833085440,2:00 PM - 4 Jul 2017,"Getting a squirmy child to sit still for a #sunscreen application can be a real challenge, but this can help http://cle.clinic/2suMp5Z pic.twitter.com/m0ephROMji",33,24,0,,,"['PlayableMedia', 'PlayableMedia--video']"
1311,ClevelandClinic,882330927170375680,1:11 PM - 4 Jul 2017,Persistent left knee pain and swelling leads to an uncommon diagnosis:http://cle.clinic/2prxYlo,64,43,2,,https://t.co/hHgdMIfEm7,
1312,ClevelandClinic,882314569628209154,12:06 PM - 4 Jul 2017,6 ways to keep ticks away and protect yourself.http://cle.clinic/2qqZzEJ,139,113,2,,https://t.co/16WwOVkAy6,
1313,ClevelandClinic,882299222309163009,11:05 AM - 4 Jul 2017,Wishing you a safe and healthy holiday! #FourthOfJulypic.twitter.com/0lBshogPk6,97,20,3,https://pbs.twimg.com/media/DD1QWOWXkAATDOU.jpg,,
1314,ClevelandClinic,882282612236144641,9:59 AM - 4 Jul 2017,Good emotional health can help you ease your IBS symptoms:http://cle.clinic/2tFRZr3,75,38,3,,https://t.co/pjIKFpybp2,
1315,ClevelandClinic,882252411011608576,7:59 AM - 4 Jul 2017,How much pee is really in the #swimming water? We break it down. #FourthOfJulyhttp://cle.clinic/2ulJW00,63,56,4,,https://t.co/f72jKxwqEi,
1316,ClevelandClinic,882215418999459840,5:32 AM - 4 Jul 2017,Is pink salt more nutritious than regular #salt? @KristinKirkpat's answer:http://cle.clinic/2rZatzs,112,70,6,,https://t.co/cexVAiGazz,
1317,ClevelandClinic,882182700995665921,3:22 AM - 4 Jul 2017,5 reasons breakfast really is the most important meal of the day:http://cle.clinic/2qf1X0A,289,182,9,,https://t.co/eQN2A9QM3g,
1318,ClevelandClinic,882082791667769345,8:45 PM - 3 Jul 2017,Study findings may lead to new treatments to delay #Alzheimers onset by 5 years: http://cle.clinic/2rcTQSb,97,43,2,,,
1319,ClevelandClinic,882058884478783489,7:10 PM - 3 Jul 2017,Female Sexual Dysfunction can fall into these five areas:http://cle.clinic/2p8Wmth,44,29,2,,https://t.co/Dvf6e39zB3,
1320,ClevelandClinic,882027680039874560,5:06 PM - 3 Jul 2017,Can you prevent a hammertoe? Why it happens and what to do.http://cle.clinic/2sHfRHv,88,54,0,,https://t.co/GxDuFqz7Rs,
1321,ClevelandClinic,882017108573306880,4:24 PM - 3 Jul 2017,Avoid these 5 habits that can damage your teeth:http://cle.clinic/2oW691G,79,51,2,,https://t.co/IblfuAVPqo,
1322,ClevelandClinic,882007548303429632,3:46 PM - 3 Jul 2017,Hot dogs or hamburgers? Ketchup or mustard? Your guide to choose the healthiest options at the cookout.http://cle.clinic/2syEeWh,104,56,3,,https://t.co/EpwTXPY4Fv,
1323,ClevelandClinic,881981128675958784,2:01 PM - 3 Jul 2017,Burns are a major safety risk when it comes to handling #fireworks. Here’s what to do if you have a small burn http://cle.clinic/2suJzxQ pic.twitter.com/bAwQ2MVTEY,45,50,2,,,"['PlayableMedia', 'PlayableMedia--video']"
1324,ClevelandClinic,881968539472584721,1:11 PM - 3 Jul 2017,True or false: you should rinse your chicken before you cook it?http://cle.clinic/2sEVzwU,130,86,6,,https://t.co/Zx3iUypoam,
1325,ClevelandClinic,881952184216301568,12:06 PM - 3 Jul 2017,"5 causes for the circles, bags and sags around your eyes.http://cle.clinic/2qdwdsQ",91,57,1,,https://t.co/JQbOuV9XQT,
1326,ClevelandClinic,881937334735953922,11:07 AM - 3 Jul 2017,Are hot dogs without the added nitrites any healthier for you?http://abcn.ws/2sEMp3l,39,41,3,,https://t.co/u5khl2Q8TT,
1327,ClevelandClinic,881920220507418624,9:59 AM - 3 Jul 2017,Foods that can quench your thirst! These 7 foods are 95% water:http://cle.clinic/2sj20WY,176,109,0,,https://t.co/hy5wqcddsw,
1328,ClevelandClinic,881890023234195456,7:59 AM - 3 Jul 2017,The dangers of under-cooking or overcooking your meats.http://cle.clinic/2qvmon6,73,51,2,,https://t.co/xV4yfDUIML,
1329,ClevelandClinic,881853029305155584,5:32 AM - 3 Jul 2017,Myths about hernias answered:http://cle.clinic/2qSVXXS,76,48,1,,https://t.co/4fZa12GSpI,
1330,ClevelandClinic,881820314153472000,3:22 AM - 3 Jul 2017,7 easy strategies to eat the best summer foods and pass on the worst from @AnnaTaylorRDhttp://cle.clinic/2tBD4yl,105,72,0,,https://t.co/iW19DpNMSo,
1331,ClevelandClinic,881710589864816640,8:06 PM - 2 Jul 2017,"70% of people with depression respond positively to antidepressants. For those that don't, this treatment may help.http://cle.clinic/2pF6qZo",165,107,4,,https://t.co/TDg7umWtnf,
1332,ClevelandClinic,881696496147513344,7:10 PM - 2 Jul 2017,The color of your urine can tell you a lot about your health:http://cle.clinic/2qgxjE4,204,162,1,,https://t.co/GNpTQ06AbH,
1333,ClevelandClinic,881665293801709569,5:06 PM - 2 Jul 2017,How to identify trigger points in your back and neck.http://cle.clinic/2qUQUWJ,157,84,3,,https://t.co/Y9R6IYxhkq,
1334,ClevelandClinic,881654720791584768,4:24 PM - 2 Jul 2017,"3 best ways to prevent crepey, thin skin as you age.http://cle.clinic/2oyQ0kV",127,67,1,,https://t.co/ya1seBTTxz,
1335,ClevelandClinic,881645160395714560,3:46 PM - 2 Jul 2017,"Itchy, dry skin? These 6 things can strip your skin of moisture:http://cle.clinic/2pndKpI",82,47,1,,https://t.co/Xm4iNYSHYU,
1336,ClevelandClinic,881618760095760384,2:01 PM - 2 Jul 2017,Do you tend to get bit by #mosquitoes while watching fireworks at dusk? Try this trick to help ease the itching http://cle.clinic/2s4TCtq pic.twitter.com/IcxOvq23kV,61,62,0,,,"['PlayableMedia', 'PlayableMedia--video']"
1337,ClevelandClinic,881589793548673024,12:06 PM - 2 Jul 2017,Try this recipe this #FourthofJuly. It's 30% less sugar & 1/2 calories & fat than the traditional version.http://cle.clinic/2ruHjLd,190,84,3,,https://t.co/5R3wf3vh6F,
1338,ClevelandClinic,881574444845731845,11:05 AM - 2 Jul 2017,Cleveland Clinic researcher receives $3.4 million @NIH grant for #epilepsy http://bit.ly/2urZkau  via @CrainsCleveland,63,16,1,,,
1339,ClevelandClinic,881557849284853760,9:59 AM - 2 Jul 2017,11 tips to stay safe around fireworks this #FourthofJuly weekend: http://cle.clinic/2ubd3Ty pic.twitter.com/luHOPEfTtg,45,28,3,,,"['PlayableMedia', 'PlayableMedia--video']"
1340,ClevelandClinic,881527635679096832,7:59 AM - 2 Jul 2017,What can happen to your eyes when you open them under water:http://cle.clinic/2t7Xj3o,111,70,2,,https://t.co/ZMllJBVgcS,
1341,ClevelandClinic,881490642223890432,5:32 AM - 2 Jul 2017,An management option for difficult-to-treat chronic knee pain:http://cle.clinic/2nXvvfV,101,53,6,,https://t.co/348MBAsELi,
1342,ClevelandClinic,881457924630994945,3:22 AM - 2 Jul 2017,What myths you shouldn't believe about medication (and what you need to know).http://cle.clinic/2sdim3t,98,74,0,,https://t.co/QTxNQ0jNra,
1343,ClevelandClinic,881359023068413952,8:49 PM - 1 Jul 2017,Study findings may lead to new treatments to delay #Alzheimers onset by 5 years: http://cle.clinic/2rcTQSb,119,76,1,,,
1344,ClevelandClinic,881348203291058176,8:06 PM - 1 Jul 2017,Discover how our bodies make sweat and why some of us do it more than others.http://cle.clinic/2p7lV8T,141,72,2,,https://t.co/f1ekk6TZpR,
1345,ClevelandClinic,881334109368340481,7:10 PM - 1 Jul 2017,Our sleep experts share their favorite and least favorite remedies for insomnia:http://cle.clinic/2ubaPDy,149,119,3,,https://t.co/QBftwCybWz,
1346,ClevelandClinic,881302904308731906,5:06 PM - 1 Jul 2017,3 reasons you get dizzy when you stand up too quickly.http://cle.clinic/2nTRDth,112,79,3,,https://t.co/jWBqVMdMVy,
1347,ClevelandClinic,881292333437902852,4:24 PM - 1 Jul 2017,Myth or fact: should you pee on a jellyfish sting? Find out:http://cle.clinic/2ub3pQI,65,67,7,,https://t.co/cALXK6uiGO,
1348,ClevelandClinic,881282788443381761,3:46 PM - 1 Jul 2017,Learn a beekeeper's trick to removing a stinger: http://cle.clinic/2txMavp pic.twitter.com/KeXM7y2ulI,67,52,0,,,"['PlayableMedia', 'PlayableMedia--video']"
1349,ClevelandClinic,881256362021339136,2:01 PM - 1 Jul 2017,"Keep safety top of mind when planning your #FourthofJuly festivities, especially when #fireworks are involved http://cle.clinic/2sYTfEy pic.twitter.com/RFopJ1mw1F",49,20,4,,,"['PlayableMedia', 'PlayableMedia--video']"
1350,ClevelandClinic,881243763527610368,1:11 PM - 1 Jul 2017,Do your taste buds change as you age? The short answer from an oral surgeon:http://cle.clinic/2t2IHUX,52,36,1,,https://t.co/7FEJDKGhSr,
1351,ClevelandClinic,881227407998504960,12:06 PM - 1 Jul 2017,Don't get burned in THESE five places.http://cle.clinic/2sZUrYh,84,47,5,,https://t.co/uKeTptayrD,
1352,ClevelandClinic,881212562188230658,11:07 AM - 1 Jul 2017,10 food swaps to keep you full and satisfied without sacrificing taste from @KristinKirkpat: http://on.today.com/2s9SsO0  (via @TODAYshow),135,77,1,,https://t.co/YFSeqHbk0I,
1353,ClevelandClinic,881195446269554690,9:59 AM - 1 Jul 2017,"How drowning can happen, even outside of the water:http://cle.clinic/2sHPpxt",70,60,1,,https://t.co/K7jZQDxeoV,
1354,ClevelandClinic,881181352942379008,9:03 AM - 1 Jul 2017,Researcher receives @NIH Grant to develop a tool to better predict #epilepsy surgery outcomes http://bit.ly/2txmS0l  via @CrainsCleveland,30,11,1,,,
1355,ClevelandClinic,881165246903099392,7:59 AM - 1 Jul 2017,Rewashing pre-washed foods can increase your risk of getting sick. Here's why:http://cle.clinic/2pYb2YB,116,86,1,,https://t.co/jB1BX2EI0O,
1356,ClevelandClinic,881155183417344000,7:19 AM - 1 Jul 2017,Meet Jesse & his bride Theresa who tied the knot after nurses threw him a last-minute wedding before he underwent emergency heart surgery.pic.twitter.com/q4QC3tDJrQ,345,73,7,,,"['PlayableMedia', 'PlayableMedia--video']"
1357,ClevelandClinic,881128276202102789,5:32 AM - 1 Jul 2017,"No flour, baking soda, or baking powder pancakes. Get the recipe: http://cle.clinic/2s7fu8g pic.twitter.com/Rro7RMevvO",313,151,9,,,"['PlayableMedia', 'PlayableMedia--video']"
1358,ClevelandClinic,881095536555827201,3:22 AM - 1 Jul 2017,6 types of fermented foods (other than pickles) to build a healthy gut:http://cle.clinic/2oyfD2P,241,172,7,,https://t.co/3Mr9wGOe2r,
1359,ClevelandClinic,880999152359845889,8:59 PM - 30 Jun 2017,6 symptoms to distinguish heart attack from heartburn.http://cle.clinic/2tvLAye,91,97,2,,https://t.co/21AdGcNUra,
1360,ClevelandClinic,880985813269581828,8:06 PM - 30 Jun 2017,"Can your nails indicate #stress, #melanoma and even kidney disease?http://cle.clinic/2riAyMs",90,66,1,,https://t.co/ROIiQNmuW0,
1361,ClevelandClinic,880975136542904321,7:23 PM - 30 Jun 2017,80% of the causes of bladder issues are related to conditions outside the bladder.http://cle.clinic/2pf1wTP,72,48,2,,https://t.co/XJwcBiXNY5,
1362,ClevelandClinic,880954607949578240,6:02 PM - 30 Jun 2017,Cleveland Clinic researcher receives $3.4 million @NIH grant for #epilepsy http://bit.ly/2urZkau  via @CrainsCleveland,52,11,2,,,
1363,ClevelandClinic,880929947774316544,4:24 PM - 30 Jun 2017,Myth or fact: cranberry juice or supplements can stop your urinary tract infection? Find out:http://cle.clinic/2tuUcou,68,52,2,,https://t.co/9SpQ4aXktu,
1364,ClevelandClinic,880920385109323778,3:46 PM - 30 Jun 2017,Cold vs. canker sores: how to treat and prevent them.http://cle.clinic/2ogyfYq,91,59,0,,https://t.co/cwpcnzWvso,
1365,ClevelandClinic,880893730374402048,2:00 PM - 30 Jun 2017,"If you get a burn while #grilling this weekend, know when it’s time to seek emergency care http://cle.clinic/2todtZq pic.twitter.com/RAoN6VkG5f",28,13,0,,,"['PlayableMedia', 'PlayableMedia--video']"
1366,ClevelandClinic,880881377377497090,1:11 PM - 30 Jun 2017,"Negative thinking can become a habit. Rather than changing the way you think, do this instead:http://cle.clinic/2oDqTM6",205,136,1,,https://t.co/LshI45t6mo,
1367,ClevelandClinic,880871429176254464,12:31 PM - 30 Jun 2017,Don't listen to ANY of these myths about #weightloss:http://cle.clinic/2oyRUSn,91,62,2,,https://t.co/Qa9VCgRE4N,
1368,ClevelandClinic,880848414136823809,11:00 AM - 30 Jun 2017,"Research team @CCLRI
uncovers biological link b/w gut bacteria & #obesity https://medicalxpress.com/news/2017-06-gut-bacteria-pathways-fat-tissue.html … via @medical_xpress",17,10,0,,https://t.co/d1BHPcawGd,
1369,ClevelandClinic,880833058080866304,9:59 AM - 30 Jun 2017,These 5 fruits are less nutritious than you think.http://cle.clinic/2suAsxc,74,49,3,,https://t.co/EV2h1c74wl,
1370,ClevelandClinic,880820475718455298,9:09 AM - 30 Jun 2017,10 food swaps to keep you full and satisfied without sacrificing taste from @KristinKirkpat: http://on.today.com/2s9SsO0  (via @TODAYshow),120,62,1,,https://t.co/YFSeqHbk0I,
1371,ClevelandClinic,880811087859462145,8:31 AM - 30 Jun 2017,Aging can cause digestive issues. Try these tips:http://cle.clinic/2u0Kkjm,55,36,0,,https://t.co/huYXDqPaJC,
1372,ClevelandClinic,880765864655507456,5:32 AM - 30 Jun 2017,What you should (and shouldn't) eat and drink before running a #marathon.http://cle.clinic/2trk19g,102,56,3,,https://t.co/Zf6pxE2BQD,
1373,ClevelandClinic,880743719661694977,4:04 AM - 30 Jun 2017,About 20 people die each day waiting for a transplant. This technology is helping preserve organs in a new way:http://bit.ly/2sqOr76,82,49,1,,https://t.co/zJEEk6KNKg,
1374,ClevelandClinic,880733148924985346,3:22 AM - 30 Jun 2017,Building muscle? Losing weight? How to match your powder with your needs:http://cle.clinic/2uoDuoa,140,76,3,,https://t.co/u3FFmOZwmM,
1375,ClevelandClinic,880632233828073472,8:41 PM - 29 Jun 2017,A new minimally invasive way to reduce osteoarthritis-associated knee pain:http://cle.clinic/2p6n6Wm,161,120,4,,https://t.co/JQUore2eiG,
1376,ClevelandClinic,880623425299116032,8:06 PM - 29 Jun 2017,2 symptoms of cancer MEN should never ignore.http://cle.clinic/2oxTkKy,61,48,1,,https://t.co/iMaPWw5eTC,
1377,ClevelandClinic,880609332882055168,7:10 PM - 29 Jun 2017,Why you shouldn't sleep on your stomach:http://cle.clinic/2tuLzer,105,71,7,,https://t.co/DoJDA8shQr,
1378,ClevelandClinic,880593729861459968,6:08 PM - 29 Jun 2017,"More #BreastCancer cases are being caught at earlier stages  @jamecancerdoc
http://www.self.com/story/breast-cancer-early-detection-obamacare … via @SELFmagazine",37,12,0,,https://t.co/abtkIFupoA,
1379,ClevelandClinic,880578138291359744,5:06 PM - 29 Jun 2017,Decode your nasal mucus by color: http://cle.clinic/2t63kOj pic.twitter.com/pQokToKxwb,50,32,1,,,"['PlayableMedia', 'PlayableMedia--gif']"
1380,ClevelandClinic,880567557379416064,4:24 PM - 29 Jun 2017,Are your parathyroid glands causing you problems? 3 symptoms to watch for:http://cle.clinic/2qpwlpX,97,65,3,,https://t.co/vqKz0X4hpg,
1381,ClevelandClinic,880557996631236610,3:46 PM - 29 Jun 2017,How to keep your kidneys healthy at every stage of life!http://cle.clinic/2qyQjO6,180,135,1,,https://t.co/TBgMLSFQA4,
1382,ClevelandClinic,880531324934569984,2:00 PM - 29 Jun 2017,"Washing hands after using the restroom is important to get rid of germs & bacteria, but how you dry them matters too http://cle.clinic/2tprFS9 pic.twitter.com/jO9jSohoY8",119,107,1,,,"['PlayableMedia', 'PlayableMedia--video']"
1383,ClevelandClinic,880520127153942528,1:15 PM - 29 Jun 2017,Are you overdoing it with these supplements?http://cle.clinic/2rwZgEB,51,40,0,,https://t.co/G1ZLyJp9TD,
1384,ClevelandClinic,880487401730265088,11:05 AM - 29 Jun 2017,"Young girl overcomes #RareDisease thanks to innovative treatment #worldsclerodermaday
http://www.cleveland19.com/story/35772907/girl-10-with-a-one-in-a-million-disease-hopes-for-a-miracle-at-cleveland-clinic … via @cleveland19news",30,10,0,,https://t.co/RghCCO7ku1,
1385,ClevelandClinic,880471110151811073,10:00 AM - 29 Jun 2017,"To find signs of a poor diet, look beyond your waistline:http://cle.clinic/2qPaJyS",61,48,0,,https://t.co/waDIeRRzw3,
1386,ClevelandClinic,880456578444525568,9:03 AM - 29 Jun 2017,Researcher receives $3.4 M @NIH Grant to develop a tool for individualized prediction for #epilepsy surgery:http://cle.clinic/2slthfx,64,24,4,,https://t.co/LDt81b5UrS,
1387,ClevelandClinic,880403476731133952,5:32 AM - 29 Jun 2017,Is turkey bacon any healthier than pork bacon?http://cle.clinic/2qcsiwC,40,35,8,,https://t.co/e7rMhDLIik,
1388,ClevelandClinic,880381330722242560,4:04 AM - 29 Jun 2017,Bee & wasp venom extracts - used in shots for those with sting allergies - have been in short supply: http://cnn.it/2sjfIsk  via @cnnhealth,37,31,0,,https://t.co/9sYuWkueHo,
1389,ClevelandClinic,880370760652607488,3:22 AM - 29 Jun 2017,This is what happens to your muscles when you start weight training:http://cle.clinic/2dcpHwE,247,125,5,,https://t.co/91GOHUZqHy,
1390,ClevelandClinic,880261038528053248,8:06 PM - 28 Jun 2017,This is the reason you binge late-night:http://cle.clinic/2nkU83U,104,64,5,,https://t.co/db2clGbm5R,
1391,ClevelandClinic,880246944270036992,7:10 PM - 28 Jun 2017,How to handle these pesky skin tags:http://cle.clinic/2rRvRGO,57,38,1,,https://t.co/fx5t3xQSDg,
1392,ClevelandClinic,880232852331274241,6:14 PM - 28 Jun 2017,Food tips to help people with #diabetes manage their blood sugars. @KristinKirkpat shares her picks: http://bit.ly/2tmJtwH  (via @DrOz),44,28,1,,,
1393,ClevelandClinic,880222172849065989,5:31 PM - 28 Jun 2017,What are the benefits of TURMERIC and how do you take it?http://cle.clinic/2sudDxP,303,187,9,,https://t.co/57qT94Lo1t,
1394,ClevelandClinic,880205169379561472,4:24 PM - 28 Jun 2017,Neck and shoulder pain so commonly overlap that some refer to it as ‘shneck’ pain.http://cle.clinic/2qkQptD,149,91,5,,https://t.co/Ep41H5SYUQ,
1395,ClevelandClinic,880195858205032453,3:47 PM - 28 Jun 2017,What is fibromuscular dysplasia and who is at risk?http://cle.clinic/2od4uUf,34,31,0,,https://t.co/b9XL5Tn9tZ,
1396,ClevelandClinic,880169449571074048,2:02 PM - 28 Jun 2017,A recent study said nearly half of US men are infected with #HPV. @romeellen says getting children vaccinated is key http://cle.clinic/2sj31h6 pic.twitter.com/NNViXWbN4U,74,78,0,,,"['PlayableMedia', 'PlayableMedia--video']"
1397,ClevelandClinic,880156599616061440,1:11 PM - 28 Jun 2017,A provocative new study sheds light on the possible cause of non-celiac #gluten sensitivity:http://cle.clinic/2nIbHex,86,58,2,,https://t.co/WHXYAMlMnC,
1398,ClevelandClinic,880140248256192514,12:06 PM - 28 Jun 2017,Add these 4 veggies to the mix to ignite your #heart health! http://cle.clinic/2tq6cZf pic.twitter.com/mCDDnVrTMY,126,94,3,,,"['PlayableMedia', 'PlayableMedia--video']"
1399,ClevelandClinic,880123635725357056,11:00 AM - 28 Jun 2017,"Jeffrey Rich, M.D., to lead Operations and Strategy for #Heart & Vascular Institute.http://cle.clinic/2tZ0jzd",20,8,0,,https://t.co/QLfGLiCRNx,
1400,ClevelandClinic,880108284681867265,9:59 AM - 28 Jun 2017,Seven WORST heart health mistakes — and how you can avoid them:http://cle.clinic/2r7oKcv,87,49,1,,https://t.co/YVIwXOTHcT,
1401,TobyCosgroveMD,880078132686069762,7:59 AM - 28 Jun 2017,Spoke w/@SquawkCNBC about the health bill. We need a bipartisan bill that gets to the root cause & drives down costshttp://cnb.cx/2t0Gs2F,103,81,5,,https://t.co/2xZ7qqC6ph,
1402,ClevelandClinic,880078086171234304,7:59 AM - 28 Jun 2017,Do you know what to eat to keep #crohns disease under control?http://cle.clinic/2oiz8Pc,42,29,1,,https://t.co/VWVBczIZGA,
1403,ClevelandClinic,880063757572911107,7:02 AM - 28 Jun 2017,"""The beauty of my practice is it's homespun. I'm out there in the community in a real melting pot."" - Cleveland native Dr. Deborah Ghazoulpic.twitter.com/FGDPqDoYmv",57,13,1,,,"['PlayableMedia', 'PlayableMedia--video']"
1404,ClevelandClinic,879908467670216704,8:45 PM - 27 Jun 2017,Modern treatments transform scleroderma from a fatal condition to a chronic illness:http://cle.clinic/2sP6iIw,59,27,0,,https://t.co/aTk0Mdlalk,
1405,ClevelandClinic,879898649345404928,8:06 PM - 27 Jun 2017,5 clues to tell if you have a problem with prescription pain medications:http://cle.clinic/2piU6uQ,45,61,1,,https://t.co/71TLlx45PS,
1406,ClevelandClinic,879884556509208576,7:10 PM - 27 Jun 2017,4 common reasons you've got that lingering cough:http://cle.clinic/2nieOia,88,63,1,,https://t.co/bUrDzAxZK2,
1407,ClevelandClinic,879853350837075968,5:06 PM - 27 Jun 2017,How much fiber is good for you if you have diverticulitis? @ConorDelaneyMD answers:http://cle.clinic/2ug3fqK,65,48,1,,https://t.co/iCAaI5jJ5C,
1408,ClevelandClinic,879842782050828289,4:24 PM - 27 Jun 2017,What does it mean if you have a spot on your lung?http://cle.clinic/2obvczD,50,30,0,,https://t.co/nwph2ncf5L,
1409,ClevelandClinic,879833219209859076,3:46 PM - 27 Jun 2017,The acid in your stomach is strong enough to burn your skin. 8 more interesting #digestive facts:http://cle.clinic/2oNlzbG,177,111,3,,https://t.co/gIVju0RX9M,
1410,ClevelandClinic,879806805576081411,2:01 PM - 27 Jun 2017,"Contrary to popular belief, tilting the head back is not the best way to treat a #bloodynose http://cle.clinic/2sJDT6J pic.twitter.com/og4BHi1KXD",88,74,0,,,"['PlayableMedia', 'PlayableMedia--video']"
1411,ClevelandClinic,879794211662344192,1:11 PM - 27 Jun 2017,Four lifestyle factors that can help you control your pain naturally:http://cle.clinic/2sbnSVi,64,51,0,,https://t.co/CGy6zGQJ7i,
1412,ClevelandClinic,879777854153568256,12:06 PM - 27 Jun 2017,Which lenses are best for reducing glare and minimizing color distortion? #NationalSunglassesDayhttp://cle.clinic/2siNMEY,72,26,1,,https://t.co/C3V6oRzX6p,
1413,ClevelandClinic,879765272982417409,11:16 AM - 27 Jun 2017,"Regan Brady is one of our patients who is defying the odds. Born deaf, she'll now attend @Harvard on a full ride. http://cle.clinic/2rXPvjp pic.twitter.com/RpZXupup0Y",190,28,2,https://pbs.twimg.com/media/DDV02NnXsAAC_pb.jpg,,
1414,ClevelandClinic,879746397356085248,10:01 AM - 27 Jun 2017,Constantly tempted by sweets or salty snacks? Fight your cravings with these tips:http://cle.clinic/2sxJSIL,71,35,0,,https://t.co/fJ6b22OU19,
1415,ClevelandClinic,879717959618265093,8:08 AM - 27 Jun 2017,"Nine of our pediatric specialties ranked among the nation’s top 50 in @usnews #BestHospitals. 
http://cle.clinic/2tgnIyr pic.twitter.com/gQjCrmsrOH",44,18,1,https://pbs.twimg.com/media/DDVhi-IWsAUzu8O.jpg,,
1416,ClevelandClinic,879678700916285441,5:32 AM - 27 Jun 2017,Some apples have higher levels of nutrients than others. These are the best ones:http://cle.clinic/2rSnVre,250,168,7,,https://t.co/JtLlpHlNIs,
1417,ClevelandClinic,879645985462509568,3:22 AM - 27 Jun 2017,5 surprising ways you can reduce teeth grinding:http://cle.clinic/2pRGPxh,83,46,0,,https://t.co/FMQpj9nZG9,
1418,ClevelandClinic,879544566348566529,8:39 PM - 26 Jun 2017,New study links TMAO to increased risks in people with acute coronary syndrome:http://cle.clinic/2sffQc1,36,29,1,,https://t.co/pX86N2j2X9,
1419,ClevelandClinic,879536262058655744,8:06 PM - 26 Jun 2017,Did you inherit the tendency to develop ingrown toenails?http://cle.clinic/2o1gnkS,54,29,3,,https://t.co/3EAUipMoSl,
1420,ClevelandClinic,879522169067196417,7:10 PM - 26 Jun 2017,How to detect if your B12 level is low:http://cle.clinic/2oObATc,75,39,0,,https://t.co/KpKpMxFJki,
1421,ClevelandClinic,879496751333261312,5:29 PM - 26 Jun 2017,Three types of topical treatments to try for #arthritis pain:http://cle.clinic/2sKFuc9,56,36,1,,https://t.co/84z7c31b1G,
1422,ClevelandClinic,879486634986790912,4:48 PM - 26 Jun 2017,Everything you need to know about PCOS.http://cle.clinic/2tPig3k,88,73,2,,https://t.co/staYxdbhyv,
1423,ClevelandClinic,879471904339480576,3:50 PM - 26 Jun 2017,People will get more tick bites and tick-borne diseases from May-July in the U.S. than any other time of year.http://cle.clinic/2sVoOwV,63,71,1,,https://t.co/9j4KZkz2D4,
1424,ClevelandClinic,879453720874037248,2:38 PM - 26 Jun 2017,Are certain people more likely to have cellulite? 5 questions answered:http://cle.clinic/2qo11Ud,31,18,0,,https://t.co/6CfsQ32plg,
1425,ClevelandClinic,879444176210862080,2:00 PM - 26 Jun 2017,Bothered by a pesky mosquito bite? Here’s a lesser-known trick that can help ease the itch http://cle.clinic/2s4TCtq pic.twitter.com/wQDoeKdZpX,70,53,0,,,"['PlayableMedia', 'PlayableMedia--video']"
1426,ClevelandClinic,879431825470435328,1:11 PM - 26 Jun 2017,Researchers uncover a number of metabolic links between asthma and obesity:http://cle.clinic/2sUmqqo,70,48,2,,https://t.co/czRHepOi3U,
1427,HealioGastro,879370746597969920,9:08 AM - 26 Jun 2017,".@ClevelandClinic researchers show fear, anxiety before #colonoscopy impact patient experience - @fascrs_updates - http://tinyurl.com/ya7ansnq",15,11,0,,,
1428,ClevelandClinic,879383505712500736,9:59 AM - 26 Jun 2017,Common reasons back pain develops as you age (and what you can do about it):http://cle.clinic/2seb3I8,96,68,3,,https://t.co/eFWNXZkM1q,
1429,BrieZeltner,879320410990538753,5:48 AM - 26 Jun 2017,"Kidney recipient marks sobriety dates 4 herself & her donor, who was killed by heroin overdose: http://ow.ly/txaz30cToLw  @Lifebanc @UNOSNews",29,20,0,,https://t.co/gmo6LJT3x3,
1430,ClevelandClinic,879353310075002880,7:59 AM - 26 Jun 2017,Three dangers of adding protein supplements to your child's diet:http://cle.clinic/2sdJ9vE,60,48,1,,https://t.co/G91wL8xAyo,
1431,ClevelandClinic,879338965341323264,7:02 AM - 26 Jun 2017,"""There are many different reasons why people slowly gain weight over time. We try to incorporate an interdisciplinary approach.""pic.twitter.com/Cbfys5AjYr",118,49,2,,,"['PlayableMedia', 'PlayableMedia--video']"
1432,ClevelandClinic,879182180357996544,8:39 PM - 25 Jun 2017,Newer evidence qualifies fibromyalgia as a neuropathic pain condition:http://cle.clinic/2pV1aiN,183,125,3,,https://t.co/6u2uTdaLsT,
1433,ClevelandClinic,879173876424605696,8:06 PM - 25 Jun 2017,"Feather, foam or body: which pillow is best?http://cle.clinic/2nD1Hnw",97,53,1,,https://t.co/n8BIgIQ07F,
